{"schema":"fleet.delegation-decision.v1","record_id":"rec_0123456789abcdef","delegation_id":"dlg_0123456789abcdef","envelope_digest":"1111111111111111111111111111111111111111111111111111111111111111","voyage_plan_hash":"aaaaaaaaaaaaaaaaaaaaaaaaaaaaaaaaaaaaaaaaaaaaaaaaaaaaaaaaaaaaaaaa","task_contract_hash":"bbbbbbbbbbbbbbbbbbbbbbbbbbbbbbbbbbbbbbbbbbbbbbbbbbbbbbbbbbbbbbbb","state_hash":"cccccccccccccccccccccccccccccccccccccccccccccccccccccccccccccccc","blocker_fingerprint":"dddddddddddddddddddddddddddddddddddddddddddddddddddddddddddddddd","local_policy_version":1,"skipper_artifact_digest":"2222222222222222222222222222222222222222222222222222222222222222","skipper_artifact_version":1,"effective_model":"gpt-5.6-sol","recovery_schema":"recovery.response.v1","created_at":"2026-07-14T19:13:42.123Z","lifecycle":"advised","reason_code":"advised","references":[{"kind":"recovery_evidence_ref","digest":"eeeeeeeeeeeeeeeeeeeeeeeeeeeeeeeeeeeeeeeeeeeeeeeeeeeeeeeeeeeeeeee"}],"result":"continue","sail_state":"locally_accepted_under_existing_policy"}
